{"version":1,"id":"utf8-claim","domain":"science","claim":"\uc815\ucd1d\ubb34 \uac00\uc124: \ud55c\uad6d\uc5b4 + \u65e5\u672c\u8a9e + \u4e2d\u6587 \u2192 BTC \u2265 150k","falsifiers":[],"causal_dag":{"nodes":[],"edges":[]},"decay":{"tau_days":1825.0,"alpha":0.1,"regime_shift_threshold":30.0},"weight":0.0,"created_at":null}