{"version":1,"id":"multi-falsifier","domain":"policy","claim":"Bill X passes 2026 session","falsifiers":[{"condition":"Senate vote NO","deadline":"2026-12-31","triggered":false},{"condition":"committee tables","deadline":null,"triggered":false},{"condition":"amendment rewrites Section 3","deadline":null,"triggered":true}],"causal_dag":{"nodes":[],"edges":[]},"decay":{"tau_days":365.0,"alpha":0.1,"regime_shift_threshold":30.0},"weight":0.0,"created_at":null}